<VillagerDialog xmlns:xsi="http://www.w3.org/2001/XMLSchema-instance"
                xsi:schemaLocation="https://vezel.dev/novadrop/dc/VillagerDialog VillagerDialog.xsd"
                id="8100"
                huntingZoneId="123"
                voiceTypeId="67"
                xmlns="https://vezel.dev/novadrop/dc/VillagerDialog">
    <Text id="3"
          huntingZoneId="123"
          endSocial="14"
          prevId="0"
          villagerId="8100">
        <Page social="4">Lots of people here show off how brave they are, and lots of them get hurt in the process. I was dispatched here to help them.</Page>
    </Text>
    <Text id="20"
          huntingZoneId="123"
          endSocial="14"
          prevId="0"
          villagerId="8100">
        <Page social="4">Lots of people here show off how brave they are, and lots of them get hurt in the process. I was dispatched here to help them.</Page>
    </Text>
    <Text id="21"
          huntingZoneId="123"
          endSocial="14"
          prevId="0"
          villagerId="8100">
        <Page social="4">Lots of people here show off how brave they are, and lots of them get hurt in the process. I was dispatched here to help them.</Page>
    </Text>
    <Text id="22"
          huntingZoneId="123"
          endSocial="14"
          prevId="0"
          villagerId="8100">
        <Page social="4">Lots of people here show off how brave they are, and lots of them get hurt in the process. I was dispatched here to help them.</Page>
    </Text>
    <Text id="23"
          huntingZoneId="123"
          endSocial="14"
          prevId="0"
          villagerId="8100">
        <Page social="4">Lots of people here show off how brave they are, and lots of them get hurt in the process. I was dispatched here to help them.</Page>
    </Text>
    <Text id="1"
          huntingZoneId="123"
          endSocial="14"
          prevId="0"
          villagerId="8100">
        <Page social="4">My clerical duties are for the Iron Order.</Page>
    </Text>
</VillagerDialog>
